{
  "$comment": "Review record for the shape catalog. One group per shape -- the unit a reviewer actually signs off on: its slots, its own justification ($comment in shapes.json), and the seed assignments that exercise it. group_id is the shape id, so renaming a shape correctly returns it to unreviewed. Authorship is not review: the Author Shapes process specifies human review of every shape, and this is where that having happened is recorded. The `groups` list is regenerated; the `status`/`reason`/`reviewed_at`/`exceptions` fields on each group are HAND-EDITED and are preserved verbatim across regenerations. Set status to 'approved' or 'withheld' after reading a group's exemplar; use `exceptions` (entry_key -> {status, reason}) for members that deviate from their group's decision. A group that disappears moves to orphaned_decisions rather than being dropped. Nothing consumes this yet: the build chain has been ungated since 2026-07-21, so this records a human judgment rather than gating output. See docs/workflow/review-records.md.",
  "generated_at": "2026-09-23T18:17:04.894526+00:00",
  "groups": [
    {
      "exceptions": {},
      "exemplar": {
        "bindings": {
          "dest_buffer": "param:recvbuf",
          "extent": {
            "count_ref": "param:count",
            "datatype_ref": "param:datatype"
          },
          "operation": "param:op",
          "scope_selector": "rank in param:comm",
          "source_buffer": "param:sendbuf"
        },
        "function": "mpi_allreduce",
        "ppm": "mpi",
        "shape_ref": "collective.all_to_all_reduce"
      },
      "group_id": "collective.all_to_all_reduce",
      "justification": "Same typed-API finding as one_to_all_uniform, plus a second instance of the same pattern: NVSHMEM/SHMEM's reduction operator (sum/min/max/...) is baked into the function name via a macro OP argument (confirmed directly in external-inputs/nvshmem/implementation/.../nvshmem_coll_api.h's NVSHMEMI_DECL_TEAM_REDUCE(NAME,TYPE,OP) and external-inputs/shmem/tex/shmem-standard/content/shmem_reductions.tex's per-operator FuncDecl list), not a runtime OPERATION-kind parameter the way MPI's op / NCCL's op are. operation_ref is bound to a literal token ('literal:sum') for NVSHMEM/SHMEM, vs. a real param: ref for MPI/NCCL.",
      "member_count": 4,
      "members": [
        "mpi:mpi_allreduce",
        "nccl:ncclAllReduce",
        "nvshmem:nvshmem_int_sum_reduce",
        "shmem:shmem_int_sum_reduce"
      ],
      "reason": null,
      "reviewed_at": null,
      "slots": [
        "source_buffer: buffer_slot",
        "dest_buffer: buffer_slot",
        "extent: extent_slot",
        "operation: operation_slot",
        "scope_selector: selector_slot"
      ],
      "status": "unreviewed"
    },
    {
      "exceptions": {},
      "exemplar": {
        "bindings": {
          "dest_buffer": "param:recvbuf",
          "extent": {
            "count_ref": "param:sendcount",
            "datatype_ref": "param:sendtype"
          },
          "index_expr": "rank_in(param:comm) * extent_size(param:sendcount, param:sendtype)",
          "root_selector": "rank == param:root",
          "scope_selector": "rank in param:comm",
          "source_buffer": "param:sendbuf"
        },
        "function": "mpi_gather",
        "ppm": "mpi",
        "shape_ref": "collective.all_to_one_indexed"
      },
      "group_id": "collective.all_to_one_indexed",
      "justification": "A real modeling ambiguity, resolved and documented rather than silently picked: df_write is attributed to participant 'member' (many), not 'root' (one), even though the buffer being written (dest_buffer) is only semantically meaningful on root's own call instance. This is necessary because offset must vary per contributing rank -- if the write were attributed to 'root' (cardinality one), rank-dependent expressions inside offset would resolve against root's own rank only, not each contributor's. The cost: this technically implies every member's own dest_buffer argument gets written, when MPI only writes root's. Same class of deliberate approximation as collective.one_to_all_uniform's root-inclusive 'member' write.",
      "member_count": 1,
      "members": [
        "mpi:mpi_gather"
      ],
      "reason": null,
      "reviewed_at": null,
      "slots": [
        "source_buffer: buffer_slot",
        "dest_buffer: buffer_slot",
        "extent: extent_slot",
        "root_selector: selector_slot",
        "scope_selector: selector_slot",
        "index_expr: index_slot"
      ],
      "status": "unreviewed"
    },
    {
      "exceptions": {},
      "exemplar": {
        "bindings": {
          "dest_buffer": "param:recvbuf",
          "extent": {
            "count_ref": "param:count",
            "datatype_ref": "param:datatype"
          },
          "operation": "param:op",
          "root_selector": "rank == param:root",
          "scope_selector": "rank in param:comm",
          "source_buffer": "param:sendbuf"
        },
        "function": "mpi_reduce",
        "ppm": "mpi",
        "shape_ref": "collective.all_to_one_reduce"
      },
      "group_id": "collective.all_to_one_reduce",
      "justification": "docs/schema/shape-catalog.md's catalog table marks this shape SHMEM-reusable, but no reduce-to-a-single-root primitive was found anywhere in external-inputs/shmem/tex/shmem-standard/content/shmem_reductions.tex -- every shmem_TYPENAME_op_reduce delivers its result to every PE in the team (that's collective.all_to_all_reduce's shape, already built and grounded in shmem_int_sum_reduce). Flagging this as a probable documentation inaccuracy rather than silently reproducing it or silently omitting SHMEM without explanation. Slot names normalized to source_buffer/dest_buffer/operation for consistency with collective.all_to_all_reduce, differing from the illustrative HTML's sendbuf/recvbuf/op naming for this specific shape.",
      "member_count": 2,
      "members": [
        "mpi:mpi_reduce",
        "nccl:ncclReduce"
      ],
      "reason": null,
      "reviewed_at": null,
      "slots": [
        "source_buffer: buffer_slot",
        "dest_buffer: buffer_slot",
        "extent: extent_slot",
        "operation: operation_slot",
        "root_selector: selector_slot",
        "scope_selector: selector_slot"
      ],
      "status": "unreviewed"
    },
    {
      "exceptions": {},
      "exemplar": {
        "bindings": {
          "block_extent": {
            "count_ref": "param:recvcount",
            "datatype_ref": "param:recvtype"
          },
          "contribution_extent": {
            "count_ref": "param:sendcount",
            "datatype_ref": "param:sendtype"
          },
          "dest_buffer": "param:recvbuf",
          "placement_offset": "rank_in(param:comm) * extent_size(param:recvcount, param:recvtype)",
          "scope_selector": "rank in param:comm",
          "source_buffer": "param:sendbuf"
        },
        "function": "mpi_allgather",
        "ppm": "mpi",
        "shape_ref": "collective.gather_to_all"
      },
      "group_id": "collective.gather_to_all",
      "justification": "Built on the 'gathered' source.kind: the written buffer is the per-participant assembly of df_read across all_participant_instances with NO operator, each contribution landing at placement_offset evaluated in the CONTRIBUTING participant's context. The proposal's open sub-question (per-contribution vs. total extent on the write) is decided here as per-contribution (block_extent), matching placement_offset's own per-contribution semantics -- the total is implied by the scope's cardinality. contribution_extent and block_extent are separate slots because MPI declares independent send/recv count+type parameter pairs (sendcount/sendtype vs recvcount/recvtype) while NCCL binds both to the same sendcount/datatype pair. shmem_{T}_fcollect matches this shape's structure exactly but has NO golden yet: its datatype is baked into the symbol (typed-API), so placement_offset's extent_size() has no datatype param: ref to point at -- blocked on the already-logged 'type:<x>' literal-token grammar decision (known-gaps-and-open-questions.md's typed-API row), deliberately not resolved as a side effect here. SHMEM's variable-length collect (vs. fcollect) stays out entirely -- the separate, still-open variable-length-collectives gap.",
      "member_count": 2,
      "members": [
        "mpi:mpi_allgather",
        "nccl:ncclAllGather"
      ],
      "reason": null,
      "reviewed_at": null,
      "slots": [
        "source_buffer: buffer_slot",
        "dest_buffer: buffer_slot",
        "contribution_extent: extent_slot",
        "block_extent: extent_slot",
        "scope_selector: selector_slot",
        "placement_offset: index_slot"
      ],
      "status": "unreviewed"
    },
    {
      "exceptions": {},
      "exemplar": {
        "bindings": {
          "dest_buffer": "param:recvbuf",
          "extent": {
            "count_ref": "param:recvcount",
            "datatype_ref": "param:recvtype"
          },
          "index_expr": "rank_in(param:comm) * extent_size(param:recvcount, param:recvtype)",
          "root_selector": "rank == param:root",
          "scope_selector": "rank in param:comm",
          "source_buffer": "param:sendbuf"
        },
        "function": "mpi_scatter",
        "ppm": "mpi",
        "shape_ref": "collective.one_to_all_indexed"
      },
      "group_id": "collective.one_to_all_indexed",